round_num,player_id,player_name,player_nickname,position,team_id,G,A,FT,FD,FF,FS,PP,I,PE,SG,DP,DD,RB,GC,CV,CA,GS,FC,total_score,current_price,price_delta
29,101719,Rafael de Carvalho França,Rafael França,LAT,267,0,0,0,0,0,0,0,0,0,0,0,0,0,0,0,0,0,0,0.0,2.0,0.0
29,101796,Gonzalo Rodrigo Carneiro Méndez,Gonzalo Carneiro,ATA,276,0,0,0,0,0,0,0,0,0,0,0,0,0,0,0,0,0,0,0.0,5.0,0.0
29,101803,Carlos Augusto Zopalato Neves,Carlos Augusto,LAT,264,1,0,0,0,2,7,0,0,13,2,0,0,7,0,0,1,0,7,0.0,4.96,0.0
29,37246,Ney Franco da Silveira Júnior,Ney Franco,TEC,290,0,0,0,0,0,0,0,0,0,0,0,0,0,0,0,0,0,0,4.41,9.72,0.3
29,101728,Diego Henrique Costa Barbosa,Diego,ZAG,276,0,0,0,0,0,0,0,0,0,0,0,0,0,0,0,0,0,0,0.0,1.0,0.0
29,101729,Fabio Augusto Luciano da Silva,Fabinho,ATA,276,0,0,0,0,0,0,0,0,0,0,0,0,0,0,0,0,0,1,0.0,0.77,0.0
29,101720,Matheus dos Santos Miranda,Miranda,ZAG,267,0,0,0,0,0,1,0,0,1,0,0,0,1,0,0,0,0,2,0.0,2.57,0.0
29,101715,Alerrandro Barra Mansa Realino de Souza,Alerrandro,ATA,282,2,1,2,6,9,9,0,3,8,0,0,0,8,0,0,0,0,5,0.0,6.27,0.0
29,101717,Marrony da Silva Liberato,Marrony,ATA,267,2,2,1,10,21,39,0,5,35,0,0,0,30,0,1,4,0,42,2.8,11.48,0.52
29,101721,João Pedro Soares Borges,João Pedro Borges,GOL,267,0,0,0,0,0,0,0,0,0,0,0,0,0,0,0,0,0,0,0.0,1.0,0.0
29,101716,Bruno Roberto Pereira da Silva,Bruninho,MEI,282,1,0,0,5,4,6,0,0,6,0,0,0,4,0,0,0,0,5,0.0,2.08,0.0
29,101861,Felipe Fernandes Sousa,Felipe Sousa,ATA,282,0,0,0,0,0,0,0,0,0,0,0,0,0,0,0,0,0,0,0.0,1.0,0.0
29,101885,Jonas Gabriel da Silva Nunes,Toró,ATA,276,2,1,0,3,10,20,0,3,28,0,0,0,11,0,1,1,0,19,0.0,4.99,0.0
29,102139,Jairo Santos de Oliveira Filho,Jairinho,ATA,267,0,0,0,2,1,4,0,0,2,0,0,0,2,0,0,0,0,1,0.0,2.89,0.0
29,101960,Vitor Hugo Naum dos Santos,Vitinho,ATA,293,1,2,0,6,7,5,0,0,8,0,0,0,4,0,0,0,0,15,0.0,2.74,0.0
29,101889,Igor Leandro Goularte do Nascimento,Igor Goularte,MEI,314,0,0,0,1,1,4,0,1,3,0,0,0,5,0,0,0,0,3,0.7,2.61,-0.02
29,102290,Gabriel José Ferreira Mesquita,Gabriel,GOL,293,0,0,0,0,0,0,0,0,0,0,0,0,0,0,0,0,0,0,0.0,1.0,0.0
29,102301,Bruno da Silva Costa Leite,Bruno Leite,MEI,293,0,0,0,0,0,0,0,0,0,0,0,0,0,0,0,0,0,0,0.0,2.0,0.0
29,102137,Vitor Eudes de Souza Costa,Vitor Eudes,GOL,283,0,0,0,0,0,0,0,0,0,0,0,0,0,0,0,0,0,0,0.0,2.0,0.0
29,102253,Lucas Halter,Lucas Halter,ZAG,293,0,0,0,2,3,2,0,0,8,1,0,0,7,0,0,1,0,5,0.0,3.09,0.0
29,101997,Braian Ezequiel Romero,Braian Romero,ATA,293,2,1,1,3,6,14,0,2,15,0,0,0,11,0,0,1,0,18,0.0,4.89,0.0
29,101911,Gabriel Calabres Nunes,Gabriel Calabres,MEI,315,0,0,0,0,0,0,0,0,0,0,0,0,0,0,0,0,0,0,0.0,2.0,0.0
29,102380,Márcio Rodrigues Velasco,Marcinho,MEI,314,0,0,0,0,0,0,0,0,0,0,0,0,0,0,0,0,0,0,0.0,1.0,0.0
29,102340,Carlos de Menezes Júnior,Cacá,ZAG,283,1,0,0,1,0,8,0,0,5,3,0,0,11,0,0,4,0,9,14.1,4.56,2.44
29,102565,Miguel Ferreira Damasceno,Miguel Figueira,MEI,290,0,0,0,0,0,1,0,0,0,0,0,0,0,0,0,0,0,0,0.0,0.86,0.0
29,102318,Caio Fernando de Oliveira,Caio Paulista,ATA,314,0,0,0,6,20,25,0,2,34,0,0,0,28,0,0,0,0,21,0.0,4.12,0.0
29,102452,Johnatan Lucas da Silva Vital,Vital,ZAG,341,0,0,0,0,0,0,0,0,0,0,0,0,0,0,0,0,0,0,0.0,1.0,0.0
29,102302,Rafael Elias da Silva,Papagaio,ATA,290,0,0,0,1,3,6,0,1,4,0,0,0,3,0,0,1,0,6,-2.0,1.03,-0.6
29,102581,Luiz Eduardo da Silva dos Santos,Dudu,ATA,290,0,0,0,0,0,0,0,0,0,0,0,0,0,0,0,0,0,1,0.0,1.33,0.0
29,102598,Hélio Júnio Nunes de Castro,Helinho,ATA,276,0,0,0,1,1,6,0,1,8,0,0,0,1,0,0,1,0,6,0.0,2.56,0.0
29,102563,Kaio Nunes Ferreira,Kaio,MEI,290,0,1,0,0,4,3,0,0,6,0,0,0,0,0,0,0,0,8,0.0,1.21,0.0
29,102599,Thiago Beserra dos Santos,Thiaguinho,MEI,264,0,0,0,0,0,0,0,0,0,0,0,0,0,0,0,0,0,0,0.0,3.0,0.0
29,102686,Yago Rafael Valadares Darub,Yago Darub,GOL,262,0,0,0,0,0,0,0,0,0,0,0,0,0,0,0,0,0,0,0.0,1.0,0.0
29,102609,Fernando Augusto de Castro Ribeiro,Fernando Castro,GOL,265,0,0,0,0,0,0,0,0,0,0,0,0,0,0,0,0,0,0,0.0,2.0,0.0
29,102719,Matheus Celestino Moresche Rodrigues,Moresche,ATA,267,0,0,0,0,0,0,0,0,0,0,0,0,0,0,0,0,0,0,0.0,2.0,0.0
29,102700,Carlos Gabriel Moreira de Oliviera,Hulk,LAT,282,0,0,0,0,0,0,0,0,5,0,0,0,3,0,0,0,0,1,0.0,2.75,0.0
29,102771,Rodrigo Fernandes Nóbrega,Rodrigo Fernandes,MEI,267,0,0,0,0,0,0,0,0,0,0,0,0,0,0,0,0,0,0,0.0,2.0,0.0
29,102909,Luan Vinicius da Silva Santos ,Luan,MEI,276,0,0,0,2,3,6,0,0,27,0,0,0,25,0,0,3,0,28,3.4,3.52,0.49
29,102906,Anderson Silva da Paixão,Anderson,GOL,293,0,0,0,0,0,0,0,0,0,0,0,0,0,0,0,0,0,0,0.0,1.0,0.0
29,102892,Yann Del Pino Rolim,Yann Rolim,MEI,315,0,0,0,0,0,0,0,0,0,0,0,0,0,0,0,0,0,0,0.0,4.0,0.0
29,102852, Eduardo Feitoza Sampaio,Dudu,MEI,267,0,0,0,0,0,0,0,0,0,0,0,0,0,0,0,0,0,0,0.0,3.0,0.0
29,102891,Francisco Jozielson Soares de Gouveia,Romarinho Gouveia,ATA,356,0,0,0,0,0,0,0,0,0,0,0,0,0,0,0,0,0,0,0.0,1.0,0.0
29,102912,César Nunes da Costa,César,LAT,266,0,0,0,0,0,0,0,0,0,0,0,0,0,0,0,0,0,0,0.0,1.0,0.0
29,102878,Miguel David Terans Pérez  ,Terans,MEI,282,0,0,0,1,0,0,0,0,1,0,0,0,0,0,0,0,0,1,0.0,3.94,0.0
29,102958,Rhuan da Silveira Castro,Rhuan,ATA,263,0,0,0,0,0,3,0,0,4,0,0,0,0,0,0,0,0,2,0.0,0.77,0.0
29,102907,Matheus Henrique Teixeira,Matheus Teixeira,GOL,275,0,0,0,0,0,0,0,0,0,0,0,0,0,0,0,0,0,0,0.0,1.0,0.0
29,102911,José Ricardo Araújo Fernandes,Zé Ricardo,MEI,266,0,0,0,0,0,0,0,0,0,0,0,0,0,0,0,0,0,0,0.0,1.0,0.0
29,103183,Andrew da Silva Ventura,Andrew,GOL,263,0,0,0,0,0,0,0,0,0,0,0,0,0,0,0,0,0,0,0.0,2.0,0.0
29,102997,Tharlis Sartori,Tharlis,MEI,315,0,0,0,0,0,1,0,0,2,0,0,0,3,0,0,0,0,2,0.0,2.84,0.0
29,103069,Matias Antonini Lui,Antonini,ZAG,284,0,0,0,0,0,0,0,0,0,0,0,0,0,0,0,0,0,0,0.0,1.0,0.0
29,103076,Mateus Gonçalves Martins,Mateus Gonçalves,ATA,354,2,0,0,2,6,8,0,1,21,0,0,0,9,0,0,1,0,9,8.5,4.21,1.51
29,102998,Vinicius Farias Locatelli,Vini Locatelli,MEI,315,0,1,0,3,1,6,0,0,3,0,0,0,2,0,0,0,0,4,0.0,1.38,0.0
29,103099,Éderson José dos Santos Lourenço da Silva,Éderson,MEI,283,2,0,1,4,3,18,0,1,26,0,0,0,17,0,0,3,0,20,13.3,4.59,1.06
29,103446,Yuri Cesar Santos de Oliveira Silva,Yuri ,MEI,262,0,0,0,0,0,0,0,0,0,0,0,0,0,0,0,0,0,0,0.0,2.0,0.0
29,103445,Kaio Jorge Pinto Ramos,Kaio Jorge,ATA,277,0,0,0,0,0,0,0,0,0,0,0,0,0,0,0,0,0,0,0.0,0.75,0.0
29,102999,Régis Tosatti Giacomin,Régis,MEI,315,0,0,0,4,11,5,0,3,15,0,0,0,12,0,0,1,0,12,0.0,3.34,0.0
29,103455,Antony Matheus do Santos,Antony,ATA,276,1,4,2,16,13,56,0,0,69,0,0,0,23,0,1,2,0,21,3.9,11.65,-0.47
29,103523,Ignácio da Silva Oliveira,Ignácio,ZAG,265,0,0,0,0,0,0,0,0,0,0,0,0,0,0,0,0,0,0,0.0,2.0,0.0
29,103579,Michel Borges De Jesus,Michel,MEI,283,0,0,0,0,0,0,0,0,0,0,0,0,0,0,0,0,0,0,0.0,2.0,0.0
29,103645,Marcos Paulo Costa do Nascimento,Marcos Paulo,ATA,266,1,2,1,4,9,10,0,0,20,0,0,0,15,0,0,0,0,6,1.5,4.33,-1.24
29,103524,Phelipe Megiolaro Alves,Phelipe,GOL,284,0,0,0,0,0,0,0,0,0,0,0,2,0,0,0,0,2,0,0.0,1.21,0.0
29,103662,Dênis de Oliveira Aguiar Júnior,Júnior,GOL,276,0,0,0,0,0,0,0,0,0,0,0,0,0,0,0,0,0,0,0.0,1.0,0.0
29,103700,Bruno Méndez Cittadini,Bruno Méndez,ZAG,264,0,0,0,0,0,1,0,0,11,1,0,0,8,0,0,3,0,5,0.0,3.85,0.0
29,103684,Kaique Rocha Lima,Kaique Rocha,ZAG,277,0,0,0,0,0,0,0,0,0,0,0,0,0,0,0,0,0,0,0.0,2.0,0.0
29,103724,Francisco Anderson de Jesus dos Santos,Anderson Ceará,MEI,277,0,0,0,0,0,0,0,0,0,0,0,0,0,0,0,0,0,0,0.0,1.0,0.0
29,103695,Jadsom Meemyas de Oliveira da Silva,Jadsom Silva,MEI,283,0,0,0,0,1,0,0,0,1,0,0,0,0,0,0,0,0,1,0.0,0.76,0.0
29,37281,Luis Antônio Venker de Menezes,Mano Menezes,TEC,275,0,0,0,0,0,0,0,0,0,0,0,0,0,0,0,0,0,0,9.58,11.19,1.16
29,103764,Gabriel Veron Fonseca de Souza,Veron,ATA,275,0,0,0,0,0,0,0,0,0,0,0,0,0,0,0,0,0,0,0.0,1.0,0.0
29,104026,João Pedro Junqueira de Jesus,João Pedro,ATA,266,4,1,1,18,22,29,0,9,30,0,0,0,16,0,0,1,0,25,1.0,6.11,0.01
29,104080,André Luiz Ribeiro da Silva,André,GOL,263,0,0,0,0,0,0,0,0,0,0,0,0,0,0,0,0,0,0,0.0,1.0,0.0
29,104084,Carlos Miguel dos Santos Pereira,Carlos Miguel,GOL,285,0,0,0,0,0,0,0,0,0,0,0,0,0,0,0,0,0,0,0.0,1.0,0.0
29,101846,Iury de Oliveira Nascimento ,Iury,LAT,314,0,1,0,0,3,10,0,0,30,4,0,0,10,0,0,1,0,14,0.0,6.43,0.0
29,104081,Alessandro Scheppa,Alessandro,MEI,263,0,0,0,0,0,0,0,0,0,0,0,0,0,0,0,0,0,0,0.0,1.0,0.0
29,104128,Jaques Bonfim Nazaré Neto,Jaques,ZAG,265,0,0,0,0,0,0,0,0,0,0,0,0,0,0,0,0,0,0,0.0,1.0,0.0
29,104086,Roberto Pinheiro da Rosa,Roberto,ZAG,285,0,0,0,1,0,5,0,0,11,2,0,0,4,0,0,2,0,6,0.0,2.43,0.0
29,104088,Matheus Bungenstab Stockl,Matheus Stockl,ZAG,282,0,0,0,0,0,0,0,0,0,0,0,0,0,0,0,0,0,0,0.0,1.0,0.0
29,104087,Pedro Lucas Schwaizer,Pedro Lucas,ATA,285,0,0,0,0,0,0,0,0,1,0,0,0,0,0,0,0,0,3,0.0,2.45,0.0
29,104104,Lucas de Oliveira Teodoro Falcão,Falcão,MEI,314,0,0,0,0,0,0,0,0,0,0,0,0,0,0,0,0,0,0,0.0,2.0,0.0
29,104250,João Victor da Silva Marcelino,João Victor,ZAG,264,0,0,0,0,0,0,0,0,0,0,0,0,0,0,0,0,0,0,0.0,2.0,0.0
29,104085,Bruno de Lara Fuchs,Bruno Fuchs,ZAG,285,0,0,0,1,1,8,0,0,23,3,0,0,11,0,0,3,0,6,0.0,2.56,0.0
29,104276,Lucas Felipe Calegari,Calegari,LAT,266,0,0,0,0,0,0,0,0,0,0,0,0,0,0,0,0,0,0,0.0,1.0,0.0
29,104257,João Lucas de Almeida Carvalho,João Lucas,LAT,262,0,0,0,0,0,3,0,0,4,4,0,0,3,0,0,1,0,4,0.0,2.39,0.0
29,104328,Rodrigo Jardim dos Santos Almeida,Rodrigo,GOL,314,0,0,0,0,0,0,0,0,0,0,0,0,0,0,0,0,0,0,0.0,1.0,0.0
29,104325,Arthur Rosseto Henriques,Arthur,GOL,315,0,0,0,0,0,0,0,0,0,0,0,0,0,0,0,0,0,0,0.0,1.0,0.0
29,104333,Julian Yoiti Suzuki Bicudo,Julian,MEI,314,0,0,0,0,0,0,0,0,0,0,0,0,0,0,0,0,0,0,0.0,2.0,0.0
29,104326,Acácio Nuno Boing,Nuno,ZAG,314,0,0,0,0,0,0,0,0,0,0,0,0,0,0,0,0,0,0,0.0,2.0,0.0
29,104327,Eduardo Luis Tapparo,Dudu,MEI,314,0,0,0,0,0,0,0,0,0,0,0,0,0,0,0,0,0,0,0.0,1.0,0.0
29,104329,João Vitor de Oliveira,João Vitor,GOL,314,0,0,0,0,0,0,0,0,0,0,0,0,0,0,0,0,0,0,0.0,1.0,0.0
29,104401,Vitor Mendes Alves,Vitor Mendes,ZAG,282,0,0,0,0,0,0,0,0,0,0,0,0,0,0,0,0,0,0,0.0,1.0,0.0
29,104356,Lucas Vinícius Dias Costa,Lucas Dias,ZAG,341,0,0,0,0,0,0,0,0,0,0,0,0,0,0,0,0,0,0,0.0,2.0,0.0
29,104404,Gabriel Alves da Cunha Borges,Gabriel,MEI,282,0,0,0,0,0,0,0,0,0,0,0,0,0,0,0,0,0,0,0.0,1.0,0.0
29,104362,Gustavo Coutinho Silva Lopes,Gustavo Coutinho,ATA,356,0,0,0,0,0,0,0,0,0,0,0,0,0,0,0,0,0,0,0.0,1.0,0.0
29,104580,Sandry Roberto Santos Goes,Sandry,MEI,277,0,0,0,0,0,0,0,0,0,0,0,0,0,0,0,0,0,0,0.0,1.0,0.0
29,104459,Rick Jhonatan Lima Morais,Rick,ATA,354,0,0,0,0,1,1,0,0,5,0,0,0,3,0,0,0,0,2,0.0,1.82,0.0
29,104415,Talison Ruan da Silva,Talison,LAT,282,0,0,0,0,0,0,0,0,0,0,0,0,0,0,0,0,0,0,0.0,1.0,0.0
29,104408,Igor Alves dos Reis,Igor Reis,MEI,282,0,0,0,0,0,0,0,0,0,0,0,0,0,0,0,0,0,0,0.0,1.0,0.0
29,104513,Abner Vinícius da Silva Santos,Abner Vinícius,LAT,293,0,1,0,0,0,1,0,0,9,1,0,0,3,0,0,0,0,4,0.0,5.07,0.0
29,104622,Hélio Júnior Rossi Francino,Hélio Júnior,LAT,282,0,0,0,0,0,0,0,0,0,0,0,0,0,0,0,0,0,0,0.0,1.0,0.0
29,104625,Weverton Guilherme da Silva Souza,Weverton,LAT,283,0,0,0,0,1,3,0,0,11,2,0,0,3,0,0,0,0,1,0.0,2.61,0.0
29,104578,Tailson Pinto Gonçalves,Tailson,ATA,277,1,0,0,4,4,10,0,3,16,0,0,0,3,0,0,0,0,14,1.5,1.33,0.01
29,104591,Caíque de Jesus da Silva,Caíque,ATA,265,0,0,0,0,0,0,0,0,0,0,0,0,0,0,0,0,0,0,0.0,2.0,0.0
29,104593,Darlan Pereira Mendes,Darlan,MEI,284,0,1,0,1,2,1,0,0,10,0,0,0,9,0,0,0,0,8,6.0,2.52,0.8
29,104650,Lucas Barros da Cunha,Lucas Barros,LAT,263,0,0,0,0,0,2,0,0,5,1,0,0,4,0,0,1,0,7,0.0,0.83,0.0
29,104651,Lucas Silva Alves,Lucas Alves,GOL,263,0,0,0,0,0,0,0,0,0,0,0,0,0,0,0,0,0,0,0.0,1.0,0.0
29,104634,Douglas do Espírito Santo Torres,Douglas Borel,LAT,265,0,0,0,0,0,0,0,0,0,0,0,0,0,0,0,0,0,0,0.0,1.0,0.0
29,104649,Heitor Rodrigues da Fonseca,Heitor,LAT,285,0,1,0,4,4,24,0,0,39,3,0,0,12,0,0,3,0,15,-1.2,1.68,0.25
29,104646,Warley Leandro da Silva,Warley,LAT,341,0,0,0,1,1,10,0,0,7,0,0,0,0,0,0,0,0,2,0.1,1.66,-0.35
29,104678,Tiago Rodrigues dos Reis,Tiago Reis,ATA,267,1,1,1,1,4,4,0,1,4,0,0,0,2,0,0,1,0,14,0.8,3.85,-0.23
29,103706,Antônio Fialho de Carvalho Neto,Neto,MEI,282,0,0,0,0,0,0,0,0,0,0,0,0,0,0,0,0,0,0,0.0,1.0,0.0
29,104991,Igo Gabriel Santos Pereira,Igo,GOL,341,0,0,0,0,0,0,0,0,0,0,0,0,0,0,0,0,0,0,0.0,1.0,0.0
29,105111,Bruno Henrique Marques Torres,Bruninho,ATA,277,0,0,0,0,0,0,0,0,0,0,0,0,0,0,0,0,0,0,0.0,2.0,0.0
29,104994,Wagner Leonardo Calvelo de Souza,Wagner Leonardo,ZAG,277,0,0,0,0,0,0,0,0,0,0,0,0,0,0,0,0,0,0,0.0,1.0,0.0
29,104824,Gerson José Laurentino Júnior,Gerson Júnior,ATA,341,0,0,0,0,0,0,0,0,0,0,0,0,0,0,0,0,0,0,0.0,0.75,0.0
29,104660,Vinícius Lopes da Silva,Vinícius,ATA,290,0,0,0,0,0,1,0,0,0,0,0,0,1,0,0,1,0,4,0.0,0.77,0.0
29,105049,Luis Henrique Tomaz de Lima,Luis Henrique ,ATA,263,0,0,0,0,0,0,0,0,0,0,0,0,0,0,0,0,0,0,0.0,1.0,0.0
29,105173,Francisco Talison Cavalcante Da Silva,Talison,LAT,356,0,0,0,0,0,0,0,0,0,0,0,0,0,0,0,0,0,0,0.0,1.0,0.0
29,105201,Vinícius Santana da Silva,Vinícius Popó,ATA,283,0,0,0,0,0,3,0,1,0,0,0,0,0,0,0,0,0,2,0.0,1.28,0.0
29,105175,Khellven Douglas Silva Oliveira,Khellven ,LAT,293,0,0,0,0,0,0,0,0,7,0,0,0,4,0,0,1,0,4,0.0,0.77,0.0
29,105199,Vinícius de Souza Costa,Vinícius,MEI,262,0,0,0,0,0,0,0,0,1,0,0,0,0,0,0,0,0,0,0.0,1.49,0.0
29,105208,Bento Matheus Krepski,Bento,GOL,293,0,0,0,0,0,0,0,0,0,0,0,0,0,0,0,0,0,0,0.0,1.0,0.0
29,105068,Reinier Jesus Carvalho,Reinier,MEI,262,3,2,0,1,7,5,0,0,14,0,0,0,5,0,0,1,0,8,0.0,3.9,0.0
29,105176,Luiz Fernando Ferreira de Souza,Luiz Fernando,ATA,293,0,0,0,0,0,0,0,0,0,0,0,0,0,0,0,0,0,0,0.0,2.0,0.0
29,105340,Flávio Henrique Sousa,Flávio,MEI,290,0,0,0,0,0,0,0,0,0,0,0,0,0,0,0,0,0,0,0.0,1.0,0.0
29,105341,Filipe Candido da Trindade,Filipe Trindade,ZAG,290,0,0,0,0,0,0,0,0,0,0,0,0,1,0,0,0,0,0,0.0,1.05,0.0
29,105198,Raphael Lopes Silva,Raphael Lopes,ATA,282,0,0,0,0,0,0,0,0,0,0,0,0,0,0,0,0,0,0,0.0,1.0,0.0
29,105396,Rafael Barbosa dos Santos,Rafael Barbosa,MEI,290,0,0,0,0,0,0,0,0,0,0,0,0,0,0,0,0,0,0,0.0,1.0,0.0
29,37614,Evandro Goebel,Evandro,MEI,277,0,2,0,1,2,14,0,2,19,0,0,0,11,0,1,0,0,19,4.2,4.96,0.4
29,105566,Riquelme Carvalho Araújo Viana,Riquelme,LAT,267,0,0,0,0,0,0,0,0,0,0,0,0,0,0,0,0,0,0,0.0,1.0,0.0
29,105339,Heron Crespo da Silva,Heron,ZAG,290,0,0,0,0,0,0,0,0,0,0,0,0,0,0,0,0,0,0,0.0,1.0,0.0
29,105282,Francisco Rodrigo de Sousa Barbosa,Diguinho,ZAG,356,0,0,0,0,0,0,0,0,0,0,0,0,0,0,0,0,0,0,0.0,2.0,0.0
29,105278,Iago Pereira Mendonça,Iago Mendonça,ZAG,290,0,0,0,0,0,0,0,0,0,0,0,0,0,0,0,0,0,0,0.0,1.0,0.0
29,105397,Felipe Dias Fonte Mosquete,Felipe Mosquete,GOL,290,0,0,0,0,0,0,0,0,0,0,0,0,0,0,0,0,0,0,0.0,1.0,0.0
29,105585,Roni Medeiros de Moura,Roni,MEI,264,0,0,0,0,0,0,0,0,0,0,0,0,0,0,0,0,0,0,0.0,2.0,0.0
29,105589,Lucas Bergantin Bragança,Lucas Bergantin,GOL,275,0,0,0,0,0,0,0,0,0,0,0,0,0,0,0,0,0,0,0.0,1.0,0.0
29,105636,Gabriel Henrique Chavoni Fornari,Gabriel Fornari,ZAG,293,0,0,0,0,0,0,0,0,0,0,0,0,0,0,0,0,0,0,0.0,1.0,0.0
29,105786,Talles Magno Bacelar Martins,Talles Magno,ATA,267,2,0,0,6,12,29,0,1,24,0,0,0,6,0,0,4,0,22,0.0,2.55,0.0
29,105584,Lucas Piton Crivellaro,Lucas Piton,LAT,264,0,0,0,0,0,0,0,0,0,0,0,0,0,0,0,0,0,0,0.0,1.0,0.0
29,105635,Geovane Silva Santos,Geovane,MEI,293,0,0,0,0,0,0,0,0,0,0,0,0,0,0,0,0,0,0,0.0,1.0,0.0
29,105612,Miguel Silveira dos Santos,Miguel,MEI,266,0,0,0,0,0,2,0,0,1,0,0,0,0,0,0,0,0,0,0.0,2.21,0.0
29,105807,Luan de Freitas Molarinho Chagas,Luan,ZAG,266,0,0,0,0,0,0,0,0,0,0,0,0,0,0,0,0,0,0,0.0,1.0,0.0
29,105899,Ivonei Júnior da Silva Rabelo,Ivonei,MEI,277,0,0,0,0,0,0,0,0,0,0,0,0,0,0,0,0,0,0,0.0,1.0,0.0
29,105647,Mauricio Magalhães Prado,Mauricio,MEI,283,1,0,0,1,2,4,0,1,10,0,0,0,3,0,0,0,0,3,0.0,1.47,0.0
29,105837,Guilherme da Silva Azevedo,Guilherme Azevedo,ATA,284,0,0,0,0,0,1,0,0,0,0,0,0,1,0,0,1,0,1,0.0,0.78,0.0
29,105836,Rondinelli da Silva Vieira ,Da Silva,ATA,284,0,0,0,0,0,2,0,0,0,0,0,0,0,0,0,0,0,1,0.0,0.78,0.0
29,105897,Pablo Marí Villar,Pablo Marí,ZAG,262,2,1,2,0,4,4,0,1,25,8,0,0,23,0,0,3,0,22,3.4,8.22,0.18
29,105838,Erik Jorgens de Menezes,Erik,LAT,285,0,0,0,0,0,3,0,0,3,0,0,0,3,0,0,0,0,0,0.0,2.05,0.0
29,105842,Lucas Eduardo Ribeiro de Souza,Edu,ZAG,283,0,0,0,0,0,0,0,0,0,0,0,0,0,0,0,0,0,0,0.0,1.0,0.0
29,105900,Allan Victor Oliveira Mota,Allanzinho,ATA,277,0,0,0,0,0,0,0,0,0,0,0,0,0,0,0,0,0,0,0.0,1.0,0.0
29,105841,Iván Darío Angulo Cortés,Iván Angulo,ATA,275,0,0,0,0,0,0,0,0,0,0,0,0,0,0,0,0,0,0,0.0,4.0,0.0
29,105846,Welligton Alexandre da Rocha,Welligton Rocha,ZAG,293,0,0,0,0,0,0,0,0,0,0,0,0,0,0,0,0,0,0,0.0,1.0,0.0
29,105866,João Pedro Celeri Machado,João Celeri,ATA,264,0,0,0,0,0,0,0,0,0,0,0,0,0,0,0,0,0,0,0.0,1.0,0.0
29,105868,Daniel Marcos Meira Novaes,Daniel Marcos,LAT,264,0,0,0,0,0,0,0,0,0,0,0,0,0,0,0,0,0,0,0.0,1.0,0.0
29,105902,José Gabriel dos Santos Silva,José Gabriel,MEI,285,0,0,0,0,0,1,0,0,3,0,0,0,1,0,0,0,0,3,0.0,0.77,0.0
29,105901,Edson Fernando da Silva Gomes,Edson,MEI,265,0,0,0,0,0,0,0,0,0,0,0,0,0,0,0,0,0,0,0.0,1.0,0.0
29,105909,Vinicius Alessandro Mingotti,Vinicius Mingotti,ATA,293,0,0,0,0,0,0,0,0,0,0,0,0,0,0,0,0,0,0,0.0,1.0,0.0
29,106000,Lucas de Ramos Silveira,Lucas Ramos,MEI,285,0,0,0,0,0,0,0,0,0,0,0,0,0,0,0,0,0,0,0.0,1.0,0.0
29,105903,José Aldo Soares de Oliveira Filho,José Aldo,MEI,285,0,0,0,0,1,0,0,0,1,0,0,0,2,0,0,0,0,0,0.0,1.53,0.0
29,105911,Rômulo Zanre Zwarg,Rômulo,MEI,283,0,0,0,0,0,0,0,0,0,0,0,0,0,0,0,0,0,0,0.0,1.0,0.0
29,105907,Alisson Fabrício dos Santos Taddei,Alisson Taddei,MEI,290,0,0,0,0,0,0,0,0,0,0,0,0,0,0,0,0,0,0,0.0,1.0,0.0
29,105906,Adriano Firmino dos Santos da Silva,Adriano,MEI,283,0,0,0,0,0,0,0,0,0,0,0,0,0,0,0,0,0,0,0.0,1.0,0.0
29,105912,Marco Antônio de Oliveira Coelho,Marco Antônio,MEI,283,0,0,0,0,0,0,0,0,0,0,0,0,0,0,0,0,0,0,0.0,1.0,0.0
29,105913,Welinton Macedo dos Santos,Welinton,ATA,283,0,0,0,0,0,1,0,1,0,0,0,0,1,0,0,0,0,0,0.0,1.29,0.0
29,105910,Jonathan Monteiro,Jonathan,ZAG,283,0,0,0,0,0,0,0,0,0,0,0,0,0,0,0,0,0,0,0.0,1.0,0.0
29,105914,Carlos Eduardo Bertolassi da Silva,Cadu Silva,ZAG,277,0,0,0,0,0,0,0,0,0,0,0,0,0,0,0,0,0,0,0.0,1.0,0.0
29,106002,João Lucas Souza Cardoso,Johnny ,ATA,285,0,0,0,0,0,0,0,0,0,0,0,0,0,0,0,0,0,0,0.0,0.77,0.0
29,106017,João Pedro Costa Contreiras Martins,João Pedro ,ATA,267,0,0,0,0,0,0,0,0,0,0,0,0,0,0,0,0,0,0,0.0,1.0,0.0
29,106077,Vanderley Ribeiro Correia Filho,Vanderley,ZAG,290,0,0,0,0,0,0,0,0,0,0,0,0,0,0,0,0,0,0,0.0,1.0,0.0
29,106159,Alexandre Melo Ribeiro da Silva,Alexandre Melo,LAT,267,0,0,0,0,0,0,0,0,0,0,0,0,0,0,0,0,0,0,0.0,1.0,0.0
29,106083,Breno Washington Rodrigues da Silva,Breno,MEI,290,0,0,0,1,0,0,0,0,2,0,0,0,2,0,1,1,0,4,0.0,0.78,0.01
29,106076,Daniel de Pauli Oliveira,Daniel Oliveira,MEI,290,0,0,0,0,0,0,0,0,0,0,0,0,0,0,0,0,0,0,0.0,1.0,0.0
29,106161,Jonathan Luiz Moreira Rosa Júnior,Jonathan,ATA,314,3,0,0,2,9,17,0,2,17,0,0,0,5,0,0,3,0,18,-1.8,4.59,-0.1
29,106201,Lucas Figueiredo dos Santos,Lucas Figueiredo,ATA,267,0,0,0,0,0,0,0,0,0,0,0,0,0,0,0,0,0,0,0.0,1.0,0.0
29,106219,Kawan Gabriel da Silva,Kawan,MEI,293,0,0,0,0,0,0,0,0,0,0,0,0,0,0,0,0,0,0,0.0,1.0,0.0
29,106200,Kaio Magno Bacelar Martins,Kaio Magno,ATA,267,0,0,0,0,0,0,0,0,0,0,0,0,0,0,0,0,0,0,0.0,1.0,0.0
29,106202,Bruno Gomes da Silva Clevelário,Bruno Gomes,MEI,267,1,0,0,0,2,7,0,0,3,0,0,0,2,0,0,2,0,8,1.3,1.49,0.72
29,106199,Gabriel Fortes Chaves,Gabriel Pec,MEI,267,0,0,0,0,1,5,0,0,7,0,0,0,3,0,0,0,0,1,0.2,1.38,-0.39
29,106160,Lucas Alexandre Galdino de Azevedo,Lucão,GOL,267,0,0,0,0,0,0,0,0,0,0,0,0,0,0,0,0,0,0,0.0,2.0,0.0
29,106312,Marx Lênin dos Santos Gonçalves,Marx Lênin,MEI,314,0,0,0,0,0,0,0,0,0,0,0,0,0,0,0,0,0,0,0.0,1.0,0.0
29,101837,Lucas Paes Souza,Lucas Paes,GOL,276,0,0,0,0,0,0,0,0,0,0,0,0,0,0,0,0,0,0,0.0,2.0,0.0
29,106371,Jhonata Robert Alves da Silva,Jhonata Robert,ATA,284,0,0,0,0,0,0,0,0,0,0,0,0,0,0,0,0,0,0,0.0,1.0,0.0
29,104074,Walce da Silva Costa Filho,Walce,ZAG,276,0,0,0,0,0,0,0,0,6,2,0,0,2,0,0,0,0,1,0.0,3.67,0.0
29,37656,Fábio Deivson Lopes Maciel,Fábio,GOL,283,0,0,0,0,0,5,0,0,10,9,2,29,0,0,0,2,29,0,8.0,11.08,1.75
29,105553,Alexander Silva de Lucena,Alexander,GOL,267,0,0,0,0,0,0,0,0,0,0,0,8,0,0,0,0,6,0,0.0,9.79,0.0
29,106323,Caio Alexandre Souza e Silva,Caio Alexandre,MEI,263,0,0,0,0,0,0,0,0,0,0,0,0,0,0,0,0,0,0,0.0,1.0,0.0
29,68817,Jonathan Doin,Paulo Miranda,ZAG,284,1,0,0,1,0,4,0,0,14,3,0,0,11,1,0,2,0,14,-1.0,3.98,-1.21
29,37657,Eduardo Luís Abonizio de Souza,Edu Dracena,ZAG,275,0,0,0,1,3,2,0,0,1,2,0,0,4,0,0,0,0,3,0.0,6.97,0.0
29,37646,Ebert William Amâncio,Betão,ZAG,314,0,0,0,1,3,24,0,0,47,6,0,0,30,0,1,6,0,16,0.0,3.65,0.0
29,37655,Rafael Martiniano de Miranda Moura,Rafael Moura,ATA,290,2,0,0,3,7,16,0,3,17,0,0,0,6,0,1,2,0,29,7.5,4.28,-0.31
29,37673,Alecsandro Barbosa Felisbino,Alecsandro,ATA,341,2,0,0,6,10,9,1,6,16,0,0,0,5,0,0,1,0,20,1.5,4.21,0.16
29,37788,Marcelo Boeck,Marcelo Boeck,GOL,356,0,0,0,0,0,1,0,0,3,2,0,15,0,0,0,1,10,0,0.0,4.9,0.0
29,38162,Frederico Chaves Guedes,Fred,ATA,283,5,3,1,12,10,35,0,12,50,0,0,0,4,0,0,8,0,41,-2.7,5.29,-0.39
29,38144,Márcio Rafael Ferreira de Souza,Rafinha,LAT,262,0,4,0,3,1,13,0,1,26,8,0,0,19,0,0,5,0,23,0.0,10.52,0.0
29,37701,Leonardo da Silva Moura,Léo Moura,LAT,284,0,1,0,0,2,11,0,1,36,4,0,0,7,0,0,1,0,6,-0.3,4.97,-0.92
29,38140,Fernando Buttenbender Prass,Fernando Prass,GOL,275,0,0,0,0,0,0,0,0,0,1,0,0,0,0,0,0,0,0,0.0,7.07,0.0
29,38229,Fábio Santos Romeu,Fábio Santos,LAT,282,2,1,1,2,2,15,0,2,40,4,0,0,15,0,0,4,0,24,0.4,8.95,0.24
29,37694,Henrique Pacheco de Lima,Henrique,MEI,283,0,0,0,3,13,44,0,1,33,0,0,0,53,0,0,3,0,37,3.5,8.27,-0.5
29,37688,Cícero Santos,Cícero,MEI,263,3,1,0,7,9,50,0,4,36,0,0,0,28,0,0,8,0,22,0.0,11.34,0.0
29,38196,Maicon Thiago Pereira de Souza,Maicon,MEI,284,3,2,0,2,2,6,0,0,29,0,0,0,13,0,0,4,0,11,0.0,9.32,0.0
29,37798,Rafael Augusto Sobis do Nascimento,Rafael Sobis,ATA,285,2,3,0,16,15,10,0,0,20,0,0,0,10,0,0,4,0,12,0.0,7.76,0.0
29,38279,Wellington Pereira do Nascimento,Wellington Paulista,ATA,356,12,2,2,15,16,33,0,10,36,0,0,0,8,0,0,6,0,43,8.8,12.55,0.16
29,38277,Thiago Neves Augusto,Thiago Neves,MEI,283,6,3,1,19,29,25,0,2,49,0,0,0,14,0,0,7,0,22,1.6,8.76,-0.64
29,38231,Diego Tardelli Martins,Diego Tardelli,ATA,284,3,1,0,13,6,17,1,5,47,0,0,0,11,0,0,1,0,18,2.1,8.2,0.28
29,38001,Anderson Pedro Nunes da Silva Campos,Anderson,GOL,265,0,0,0,0,0,0,0,0,0,0,0,1,0,0,0,0,2,0,0.0,2.08,0.0
29,38315,Jadson Rodrigues da Silva,Jadson,MEI,264,0,1,0,1,6,3,0,0,21,0,0,0,1,0,0,3,0,6,0.5,2.86,0.13
29,38311,Márcio Rodrigues Araújo,Márcio Araújo,MEI,315,0,0,0,3,6,38,0,0,32,0,0,0,52,0,1,3,0,31,3.0,8.88,0.45
29,38394,Thiago Heleno Henrique Ferreira,Thiago Heleno,ZAG,293,0,0,0,4,0,10,0,0,13,0,0,0,4,0,0,4,0,13,-1.7,0.78,-0.67
29,38336,Adriano Correia Claro,Adriano,LAT,293,1,1,0,0,1,3,0,0,18,2,0,0,8,0,0,3,0,9,1.1,9.3,-0.82
29,38431,Diego Cavalieri,Diego Cavalieri,GOL,263,0,0,0,0,0,0,0,0,1,0,0,21,0,0,0,0,9,1,0.0,6.35,0.0
29,38451,Carlos Andrade Souza,Carlinhos,LAT,341,2,0,0,6,10,21,0,2,56,8,0,0,39,0,0,2,0,18,0.0,7.45,0.0
29,38509,Diego Alves Carreira,Diego Alves,GOL,262,0,0,0,0,0,3,0,0,12,11,2,33,2,0,0,0,18,0,0.0,10.27,0.0
29,38515,Marcos Roberto da Silva Barbosa,Marquinhos Silva,ZAG,314,0,0,1,0,9,7,0,1,24,1,0,0,16,0,0,2,0,15,0.0,5.43,0.0
29,38523,Edílson Mendes Guimarães,Edílson,LAT,283,0,0,2,0,4,6,0,0,23,3,0,0,17,0,2,2,0,12,0.0,6.35,0.0
29,38505,Leandro Castan da Silva,Leandro Castan,ZAG,267,2,1,0,2,4,13,0,2,22,5,0,0,18,0,0,8,0,16,-2.5,8.91,-0.6
29,38648,Anderson Hernanes de Carvalho Andrade Lima,Hernanes,MEI,276,2,4,0,12,14,23,0,1,25,0,0,0,24,0,0,4,0,23,-0.6,12.81,-0.23
29,38738,Douglas dos Santos,Douglas,MEI,314,0,1,0,1,6,8,0,2,34,0,0,0,2,0,0,1,0,3,5.1,5.08,0.92
29,38545,Felipe Melo de Carvalho,Felipe Melo,MEI,275,3,1,0,4,14,23,0,1,39,0,0,0,24,0,1,7,0,32,9.0,7.83,1.83
29,38632,Matheus Ferraz Pereira,Matheus Ferraz,ZAG,266,1,0,0,4,3,2,0,1,6,0,0,0,11,0,0,1,0,7,0.0,6.23,0.0
29,38573,Nílton Ferreira Júnior,Nilton,MEI,341,0,0,0,0,2,7,0,0,12,0,0,0,8,0,0,3,0,10,0.0,2.71,0.0
29,38913,Anderson Luiz de Carvalho,Nenê,MEI,266,3,2,0,4,18,31,0,2,67,0,0,0,15,0,1,0,0,17,-0.7,6.19,-0.41
29,38750,Filipe Luís Kasmirski,Filipe Luís,LAT,262,0,0,0,1,0,10,0,0,30,6,0,0,36,0,0,0,0,21,2.1,13.05,-0.55
29,39850,Vagner Carmo Mancini,Vagner Mancini,TEC,282,0,0,0,0,0,0,0,0,0,0,0,0,0,0,0,0,0,0,1.36,6.65,0.1
29,38910,Ricardo de Oliveira,Ricardo Oliveira,ATA,282,2,2,1,9,14,17,1,2,11,0,0,0,6,0,0,0,0,15,1.1,12.63,0.15
29,38939,Daniel Alves da Silva,Daniel Alves,LAT,276,1,2,1,3,10,24,0,3,43,4,0,0,20,0,0,3,0,29,-0.5,14.85,-2.18
29,41929,Renato Portaluppi,Renato Gaúcho,TEC,284,0,0,0,0,0,0,0,0,0,0,0,0,0,0,0,0,0,0,4.26,12.79,-0.35
29,38909,Diego Ribas da Cunha,Diego,MEI,262,0,0,2,6,7,16,1,0,25,0,0,0,9,0,0,5,0,10,0.0,5.52,0.0
29,40006,Abel Carlos da Silva Braga,Abel Braga,TEC,283,0,0,0,0,0,0,0,0,0,0,0,0,0,0,0,0,0,0,5.6,10.15,0.53
29,39572,José Renato da Silva Júnior,Renato,ATA,315,0,0,0,4,5,14,0,0,5,0,0,0,3,0,0,0,0,1,2.3,5.01,0.19
29,41258,Adilson Dias Batista,Adilson Batista,TEC,354,0,0,0,0,0,0,0,0,0,0,0,0,0,0,0,0,0,0,6.91,11.14,1.04
29,41327,Vanderlei Luxemburgo da Silva,Vanderlei Luxemburgo,TEC,267,0,0,0,0,0,0,0,0,0,0,0,0,0,0,0,0,0,0,1.92,8.24,-0.03
29,38959,Vagner Silva de Souza,Vagner Love,ATA,264,5,0,0,5,8,33,0,8,33,0,0,0,13,0,0,4,0,29,0.0,5.11,0.0
29,42116,Willian Gomes de Siqueira,Willian,ATA,275,4,1,1,7,3,13,0,2,20,0,0,0,4,0,1,1,0,10,0.3,7.65,-1.0
29,42232,William José de Souza,Amaral,MEI,315,0,0,0,0,2,2,0,0,4,0,0,0,7,0,0,0,0,6,0.0,2.79,0.0
29,42145,Egídio de Araújo Pereira Júnior,Egídio,LAT,283,0,1,0,7,7,19,0,1,61,7,0,0,36,0,0,1,0,25,4.9,9.81,0.94
29,42499,Bruno Vieira do Nascimento,Bruno,LAT,285,0,0,0,0,1,5,0,0,13,4,0,0,7,0,1,1,0,7,0.0,4.62,0.0
29,42500,Fagner Conserva Lemos,Fagner,LAT,264,1,2,0,4,4,32,0,0,72,9,0,0,39,0,0,5,0,19,-0.1,12.34,-1.13
29,42501,Luiz Rhodolfo Dini Gaioto,Rhodolfo,ZAG,262,0,0,0,1,1,0,0,0,3,2,0,0,1,0,0,0,0,4,0.0,4.62,0.0
29,42234,Cássio Ramos,Cássio,GOL,264,0,0,0,0,0,5,0,0,11,10,0,25,0,0,0,6,19,0,-4.0,7.18,-2.26
29,42222,Osvaldo Lourenço Filho,Osvaldo,ATA,356,3,3,2,4,12,11,0,0,31,0,0,0,11,0,1,2,0,22,0.0,5.1,0.0
29,47134,Sebastião Sousa Costa,Tião,MEI,356,0,0,0,0,0,0,0,0,0,0,0,0,0,0,0,0,0,0,0.0,1.0,0.0
29,42491,Márcio Gonzaga de Azevedo,Márcio Azevedo,LAT,293,0,2,0,1,4,19,0,3,39,6,0,0,16,0,0,5,0,25,-1.6,4.86,-0.27
29,49651,Ernando Rodrigues Lopes,Ernando,ZAG,265,1,0,1,0,0,4,0,0,3,4,0,0,4,0,0,0,0,2,0.0,10.78,0.0
29,42477,Maurício Donizete Ramos Júnior,Maurício Ramos,ZAG,315,0,0,0,2,1,9,0,0,14,4,0,0,6,0,0,1,0,15,5.0,4.98,1.2
29,49673,Júlio César Jacobi,Júlio César,GOL,284,0,0,0,0,0,0,0,0,1,2,0,17,0,0,0,0,13,0,0.0,6.29,0.0
29,49675,Alexandre Rodrigues da Silva,Alexandre Pato,ATA,276,5,0,0,13,20,28,0,13,36,0,0,0,14,0,0,1,0,19,0.9,8.83,-0.39
